{
  "contract_version": "1.0.0",
  "event_id": "77777777-7777-4777-8777-777777777777",
  "run_id": "11111111-1111-4111-8111-111111111111",
  "sequence": 3,
  "type": "PO_COMPLETED",
  "actor": "po",
  "ts": "2025-01-15T12:00:02Z",
  "correlation_id": "22222222-2222-4222-8222-222222222222",
  "causation_id": "66666666-6666-4666-8666-666666666666",
  "task_id": "55555555-5555-4555-8555-555555555555",
  "payload": {"backlog_hash": "sha256:bbbbbbbbbbbbbbbbbbbbbbbbbbbbbbbbbbbbbbbbbbbbbbbbbbbbbbbbbbbbbbbb", "ready_story_ids": ["STORY-001"], "handoff_count": 1},
  "meta": {"model": "claude-opus-5", "tokens_in": 100, "tokens_out": 200, "latency_ms": 500, "container_id": "po-worker-1"}
}
