{
  "contract_version": "1.0.0",
  "event_id": "33333333-3333-4333-8333-333333333333",
  "sequence": 1,
  "run_id": "11111111-1111-4111-8111-111111111111",
  "ts": "2026-08-22T16:00:00Z",
  "actor": "system",
  "type": "RUN_CREATED",
  "correlation_id": "11111111-1111-4111-8111-111111111111",
  "causation_id": null,
  "task_id": null,
  "payload": {
    "state": "RECEIVED"
  },
  "meta": {
    "model": null,
    "tokens_in": 0,
    "tokens_out": 0,
    "latency_ms": 4,
    "container_id": null
  }
}
